BusinessName,TaxCode,RegisteredOffice,ZipCode,digitalAddress,vatNumber,recipientCode
Consiglio Provinciale Ordine dei Consulenti del Lavoro di Nuoro,80007420914,"Via Dessanay, 154",08100,ordine.nuoro@consulentidellavoropec.it,80007420914,cpocl_nu
Consiglio Regionale del Piemonte,97603810017,"Via Alfieri, 15",10121,dir.segreteriagen@cert.cr.piemonte.it,97603810017,cr_piem
Consiglio Regionale dell'Abruzzo,80003630664,"Via Michele Jacobucci, 4",67100,protocollo@pec.crabruzzo.it,80003630664,cr_abbru
Consiglio regionale della Calabria,80001350802,Via Cardinale Portanova,89123,consiglioregionale@pec.consrc.it,80001350802,r_calabr
Consiglio Regionale della Campania,80051460634,Centro Direzionale Isola F13,80143,protocollo.generale@pec.cr.campania.it,80051460634,cr_campa
Consiglio Regionale della Liguria,95035750108,Via Fieschi 15,16121,consiglio@cert.regione.liguria.it,95035750108,r_crli
Consiglio Regionale della Lombardia,80053570158,Via Fabio Filzi 22,20124,protocollo.generale@pec.consiglio.regione.lombardia.it,80053570158,r_lomb
Consiglio Regionale della Puglia,80021210721,"Via G. Gentile, 52",70124,protocollo@pec.consiglio.puglia.it,80021210721,crpuglia
Consiglio Regionale della Regione Autonoma Trentino Alto - Adige Sudtirol,80013030228,Piazza Duomo 3,39100,consiglio@pec.consiglio.regione.taa.it,80013030228,cr_taas
Consiglio Regionale della Sardegna,92027820924,"Via Roma, 25",09125,consiglioregionale@pec.crsardegna.it,92027820924,crsarde
Consiglio Regionale della Valle D'Aosta,91000930072,"Piazza Deffeyes, 1",11100,consiglio.regione.vda@cert.legalmail.it,91000930072,cr_valle
Consiglio Regionale Friuli Venezia Giulia,80016340327,Piazza OBERDAN 6,34133,consiglio@certregione.fvg.it,80016340327,r_friuli
Consiglio Regionale Ligure dell'Ordine dei Giornalisti,80154370102,Via Fieschi 3-26,16121,ordineliguregiornalisti@legalmail.it,80154370102,oligio
Consip Spa,05359681003,"Via Isonzo, 19/E",00198,postaconsip@postacert.consip.it,05359681003,consips
Consorzio-azienda Naturno-senales-plaus,02529710218,"Via Gustav Flora, 10",39025,altersheim@pec.it,02529710218,c_F8494
Consorzio 1 Toscana Nord,02350460461,"Via Della Migliarina, 64",55049,protocollo@pec.cbtoscananord.it,02350460461,cotn
Consorzio 2 Alto Valdarno,02177170517,Via ERNESTO ROSSI 2/L,52100,cbaltovaldarno@pec.it,02177170517,R2C20VBG
Consorzio 4 Basso Valdarno,02127580500,"Via San Martino, 60",56125,segreteria@pec.c4bassovaldarno.it,02127580500,cbv
Consorzio 5 Toscana Costa,01779220498,"Via Degli Speziali, 17",57021,cb5@pec.cbtoscanacosta.it,01779220498,ctc
Consorzio Acquedotto Benevello - Montelupo Albese - Rodello,00279250047,"Piazza Comunale, 6",12050,acquedotto.bmr@legalmail.it,00279250047,cabmar
Consorzio Acquedotto Comuni Media Sabina,00086470572,"Via Municipio, 5",02041,consorzioacquedotto.casperia.ri@legalmail.it,00086470572,cacoms
Consorzio Acquedotto Tra I Comuni di Fragneto Monforte e Fragneto L'Abate,00251130621,Via Carlo Alberto 4,82020,consorzioacquedotto.fragnetomfragnetoa.bn@pec.it,00251130621,catcfm
CONSORZIO AEROPORTO - SALERNO PONTECAGNANO SOC. CONSORTILE A RESPONSABILITA' LIMITATA,01087990659,"Via Gen. Clark, 19/21",84131,consorzioaeroporto@legalmail.it,01087990659,Consaeroportosa_20210308
Consorzio Albese Braidese Servizi Rifiuti,90011440048,"Piazza Risorgimento, 1",12051,coabser@pec.it,90011440048,cabs_004
Consorzio Alessandrino di Bacino per La Raccolta e Il Trasporto Dei Rifiuti Solidi Urbani,80052380062,Via Giovanni Plana 22,15121,consorzioalessandrinorsu@legalmail.it,80052380062,cbal_006
Consorzio Ambiente Territorio e Servizi,01848280168,Piazza Dante 12,24040,consorzioats@pecm.it,01848280168,cat
Consorzio Attivita' Produttive Aree e Servizi,80009350366,Via Razzaboni 82,41122,cap.modena@pec.it,80009350366,capas
Consorzio B.I.M. dello Spol,92000240140,plaza dal comun 93,23041,bimspol@pec.it,92000240140,cbims
Consorzio B.I.M. Nera e Velino,84005780543,Piazza Giuseppe Garibaldi 26,06043,postacertificata@pec-bimcascia.com,84005780543,cbim
Consorzio B.I.M. Piave di Treviso,00282090265,Via Verizzo 1030,31053,consorziobimpiavetreviso@pec.ascocert.it,00282090265,cbimp_tv
Consorzio Bacino Imbrifero Montano del Bormida Genova,95151400108,"Via Garibaldi, 9",16121,bimbormidage@postecert.it,95151400108,bimborge
Consorzio Bacino Imbrifero Montano del Po,85002190040,Via Santa Croce 4,12034,bimdelpo@legalmail.it,85002190040,cbimp
Consorzio Bacino Imbrifero Montano del Ticino in Provincia di Como,84000930135,"Via Cuccio, 8",22018,bimporlezza@pec.it,84000930135,cbimtc
Consorzio Bacino Imbrifero Montano del Varaita,85001990044,"Piazza G. Marconi, 5",12020,consorzio.bimvaraita@legalmail.it,85001990044,cbimdv
Consorzio Bacino Imbrifero Montano dell' Entella,82000750107,Piazza Cavagnari 7,16044,bimentella@pec.it,82000750107,cbimen
Consorzio Bacino Imbrifero Montano dell'Agno,85001170241,"Piazza Del Comune, 8",36078,bimagno@legalmail.it,85001170241,cbima
Consorzio Bacino Imbrifero Montano Lago Como Fiumi Brembo e Serio,80027640160,Via Taramelli 36,24121,bimbg@pec.it,80027640160,cbimbg
Consorzio Bacino Imbrifero Montano Torrente Enza,80012950343,"Piazza Cardinal Ferrari, 1",43025,consorzio.bim.enza@pec.net,80012950343,cbimte
Consorzio Bim del Chiese,86001190221,"Via Oreste Baratieri, 11",38083,bimdelchiesecondino@legalmail.it,86001190221,BIMCHIE
Consorzio Bonifica Cereglio Pieve di Roffeno,03751270376,Via Provinciale 63,40038,cereglio.consorzio@pec.it,03751270376,consbonifaceregno_20220929
Consorzio Bonifica di Paestum,81000270652,Via Magna Graecia 341,84047,consorziopaestum2@pec.it,81000270652,cbp_065
Consorzio Brianteo Villa Greppi,85001680132,"Via Monte Grappa, 21",23876,consorziobrianteo.villagreppi@halleypec.it,85001680132,cbvg
Consorzio C.A.R.S.O.,04002250720,"Strada Prov. Per Casamassima Km. 3,00",70010,consorziocarso@pec.it,04002250720,ccars
Consorzio Casalasco Servizi Sociali,90007540199,Via Corsica 1,26041,amministrazioneconcass@legalmail.it,90007540199,ccss
Consorzio Chierese per I Servizi,90005860011,Strada FONTANETO 119,10023,ccs@postecert.it,90005860011,ccis_
Consorzio Cimiteriale Fra I Comuni di Frattamaggiore Grumo Nevano e Frattaminore,80024840631,Via Lupoli Snc Frattamaggiore,80027,consorziofratta@pec.it,80024840631,cccfgnf
Consorzio Cimiteriale Tra I Comuni di Casoria Arzano Casavatore,80103900637,Via Porziano Snc,80022,direttore@pec.cimiteroarzanocasavatorecasoria.na.it,80103900637,cctic
Consorzio Cimiteriale Tra I Comuni di Mugnano di Napoli e Calvizzano,80101860635,"Piazza Municipio, 1",80018,info@pec.consorziocimiterialemugnanocalvizzano.it,80101860635,cctmnc
Consorzio Comuni B.I.M. Adige Trento,80001130220,"Piazza Centa, 13",38122,info@pec.bimtrento.it,80001130220,ccbimat
Consorzio Comuni B.I.M. Brenta,81000730226,Corso Ausugum 82,38051,bimbrentatrento@legalmail.it,81000730226,ccbim_tn
Consorzio Comuni Bacino Imbrifero Montano di Valle Camonica,00863380176,Piazza Tassara 3,25043,protocollo@pec.bimvallecamonica.bs.it,00863380176,ccbimvc
Consorzio Comuni del Bacino Imbrifero Montano dell'Adige della Provincia di Verona,80010120238,"Via Ca' Di Cozzi, 41",37124,bimadige.vr@pec.it,80010120238,ccbi_023
Consorzio Costruzione e Gestione Impianti Sportivi,01466680137,"Piazza Italia, 1",22070,consorzioimpiantisportivi.cagno@legalmail.it,01466680137,ccgis
Consorzio Culturale del Monfalconese,00168550317,Piazza Unita' 24,34077,consorzio-culturale-monfalconese@certgov.fvg.it,00168550317,ccm_
Consorzio Dei Comuni B.I.M. Sarca-mincio-garda,86001170223,"Viale Dante, 46",38079,bim.sarca@legalmail.it,86001170223,cdcbi
Consorzio Dei Comuni Compresi nel Bacino Imbrifero Montano del Fiume Bacchiglione,83002190243,"Via Pasini, 33",36015,consorziobimbacchiglioneschio@legalmail.it,83002190243,cdccbim
Consorzio dei Comuni del Bacino Imbrifero Montano del Brenta Appartenenti alla Provincia di Belluno,82000710259,"Piazza I Novembre, 14",32030,bimbrentabelluno@pec.it,82000710259,cbiapp
Consorzio dei Comuni del Bacino Imbrifero Montano del Piave  appartenenti  alla Provincia di Belluno,80000330250,Via Masi Simonetti n. 20,32100,segreteria@cert.consorziobimpiave.it,80000330250,Cocopibl
Consorzio Dei Comuni del Bacino Imbrifero Montano dell'Adda,80000410144,"Lungo Mallero Diaz, 18",23100,bimadda@registerpec.it,80000410144,cdcbima
Consorzio dei Comuni del Bacino Imbrifero Montano della Drava,93016030301,"Via Roma, 3",33018,consorzio.bimdrava@certgov.fvg.it,93016030301,cbimd
Consorzio Dei Comuni del Cassinate per La Programmazione e Gestione Dei Servizi Sociali,90009320608,Piazza Sturzo,03030,postmaster@pec.consorzioservizisociali.fr.it,90009320608,cdccl
Consorzio Dei Comuni della Provincia di Bolzano del Bacino Imbrifero Montano dell' Adige,80012990216,"Via Canonico Michael Gamper, 10",39100,bimwegbz@legalmail.it,80012990216,cdcpb
Consorzio Dei Comuni della Valle D'Aosta Bacino Imbrifero Montano della Dora Baltea,80001790072,Piazza Narbonne 16,11100,protocollo@pec.bimvda.it,80001790072,cdcvd_
Consorzio Dei Comuni per L'Acquedotto del Monferrato,82001730066,"Via Ferraris, 3",14036,ccam@legalmail.it,82001730066,cdcla
CONSORZIO DEI NAVIGLI SPA,13157010151,Via Cesare Battisti n. 2,20080,protocollo@pec.consorzionavigli.it,13157010151,Consorzionavigli_20201230
Consorzio dei Servizi Sociali del Verbano,93015370039,"Viale Azari, 104",28924,cssv-verbania@pec.cssv.it,93015370039,CSSV
Consorzio dei Servizi Socio Assistenziali del Chierese,07305160017,"Strada Valle Pasano, 4",10023,protocollocssac@pec.it,07305160017,cdssac
Consorzio del Bacino Imbrifero del Fiume Tronto,92009260446,"Via Alessandria,12",63100,info@pec.bimtronto-ap.it,92009260446,cbift_ap
Consorzio del Bacino Imbrifero Montano del Lago di Como del Brembo e Serio,84003210139,Via Regina Levante,22015,bimcomo@legalmail.it,84003210139,cbiml
Consorzio del Bacino Imbrifero Montano del Tagliamento Nelle Province di Udine e Pordenone,84000550305,Via Renato Del Din 6,33028,consorzio.bimtagliamento@certgov.fvg.it,84000550305,cbimt_ud
Consorzio del Bacino Imbrifero Montano dell'Oglio,80039900164,"Via Casalino, 27",24121,segreteria@pec.bimoglio.it,80039900164,cbimod
Consorzio del Parco Nazionale dello Stelvio,00685060147,"Via De Simoni, 42",23032,parcostelvio@pec.stelviopark.it,00685060147,cpns_so
Consorzio del Ticino,80130230156,Corso Di Porta Nuova 18,20121,regolazione@pec.ticinoconsorzio.it,80130230156,ct_015
Consorzio dell'Adda,80060130152,"Corso Garibaldi, 70",20121,consorzio.adda@legalmail.it,80060130152,ca_015
Consorzio dell'Oglio,80012590172,"Via Solferino, 20/c",25121,segreteria@pec.oglioconsorzio.it,80012590172,co_017
Consorzio della Bonifica Burana,94149560362,"Corso Vittorio Emanuele II, 107",41121,segreteria@pec.consorzioburana.it,94149560362,cbbu
Consorzio della Bonifica Renana,91313990375,"Via Santo Stefano, 56",40125,bonificarenana@pec.it,91313990375,cbrbo
Consorzio della Bonificazione Umbra,02806890543,"Via Arco Di Druso, 37",06049,direzione@pec.bonificaumbra.it,02806890543,cbumb
Consorzio Depurazione Acque Reflue della Valle dell'Orba,80053440063,"Piazza Matteotti, 2",15077,consdeporba@legalmail.it,80053440063,cdar
Consorzio Depurazione del Savonese S.P.A.,92040230093,Via Caravaggio 1,17100,postacert@pec.depuratore.sv.it,92040230093,cdssp
Consorzio Desio Brianza A.S.C.,91005610158,"Via Lombardia, 59",20832,AMMINISTRAZIONE@PEC.CODEBRI.MB.IT,91005610158,codebri
CONSORZIO DI AREA VASTA COVAR14,80102420017,Via Aldo Cagliero N. 3,10041,protocollo.covar14@legalmail.it,80102420017,cvr_001
Consorzio di Bacino 16,08867800016,"P.zza Liberta', 4",10036,amministrazione@cert.consorziobacino16.it,08867800016,cb_to
Consorzio di Bacino Dei Rifiuti dell'Astigiano,00238630057,"Via Brofferio, 83",14100,cbra@legalmail.it,00238630057,cbdr_005
Consorzio di Bacino Verona Due del Quadrilatero,02795630231,"Corso Garibaldi, 24",37069,consorziovr2@legalmail.it,02795630231,con_vr2
Consorzio di Bonifica 3 Medio Valdarno,06432250485,Viale della Toscana 21,50127,info@pec.cbmv.it,06432250485,cb3mv
Consorzio di Bonifica Adige Euganeo,91022300288,Via Augustea 25,35042,adigeuganeo@pec.it,91022300288,cbae_028
Consorzio di Bonifica Alta Pianura Veneta,92021070237,Via Guglielmo Oberdan n 2,37047,consorzio@pec.altapianuraveneta.eu,92021070237,1R9VQFM0
Consorzio di bonifica Bacchiglione,92223390284,"Via Vescovado, 11",35141,bonifica@pec.consorziobacchiglione.it,92223390284,cbac_20160207
Consorzio di Bonifica del Nord Sardegna,01835450907,"Via Vittorio Veneto, 16",07014,cbnordsardegna@pec.it,01835450907,cbns
CONSORZIO DI BONIFICA DEL SANNIO ALIFANO,82000610616,"Viale DELLA LIBERTA', 61",81016,SANNIOALIFANO@PEC.IT,82000610616,TN1NQL32
Consorzio di Bonifica dell'Agro Pontino,91043800597,"Corso G. Matteotti, 101",04100,bonifica.latina@pec.it,91043800597,cbap
Consorzio di Bonifica dell'Emilia Centrale,91149320359,Corso Garibaldi 42,42121,protocollo@pec.emiliacentrale.it,91149320359,cbec_
Consorzio di Bonifica dell'Oristanese,90022600952,"Via Cagliari, 170",09170,tecnicocbo@pec.it,90022600952,cbo
Consorzio di Bonifica dell'Ufita,81001310648,"Via Aldo Moro, 58",83035,bonifica.ufita@pec.it,81001310648,cbuf
Consorzio di Bonifica della Basilicata,93060620775,"Via Annunziatella, 64",75100,consorzio@pec.bonificabasilicata.it,93060620775,cbbas
Consorzio di Bonifica della Gallura,91017110908,Viale Paolo Dettori 43,07021,cbgallura@pec.it,91017110908,cbg_104
Consorzio di Bonifica della Media Pianura Bergamasca,80017830169,"Via Gritti, 21/25",24125,info@pec.cbbg.it,80017830169,cbmpb
Consorzio di Bonifica della Piana di Venafro,80001650946,"Via Colonia Giulia, 2",86079,protocollo@pec.bonificavenafro.it,80001650946,cbp_094
Consorzio di Bonifica della Sardegna Centrale,80002690917,"Via Santa Barbara, 30",08100,protocollo@pec.cbsc.it,80002690917,cbsc
Consorzio di Bonifica della Sardegna Meridionale,80000710923,"Via Dante, 254",09128,cbsm@pec.cbsm.it,80000710923,cbsm
Consorzio di Bonifica Delle Marche,92049990416,"Via degli Abeti, 160",61122,pec@pec.bonificamarche.it,92049990416,cbdm
Consorzio di Bonifica di Piacenza,91096830335,Strada Val Nure,29122,cbpiacenza@pec.it,91096830335,cbp_033
Consorzio di Bonifica e d’Irrigazione del Canale Lunense,81000890111,Via Agostino Paci 2,19038,canale-lunense@legalmail.it,81000890111,canale-lunense_20210715
Consorzio di Bonifica Est Ticino Villoresi,97057290153,Via Lodovico Ariosto N. 30,20145,etvilloresi@pec.it,97057290153,cbetv
Consorzio di Bonifica Garda Chiese,01706580204,"Corso Vittorio Emanuele II, 122",46100,cb.gardachiese-bonifica@pec.regione.lombardia.it,01706580204,cbgc_020
Consorzio di Bonifica in Destra del Fiume Sele,80000590655,Corso Vittorio Emanuele 143,84122,bonificadestrasele@pec.it,80000590655,cbdfs
Consorzio di Bonifica Integrale Larinese,00938610706,Viale Giulio Cesare N. 62,86035,consorziobonificaintegra@pec.it,00938610706,cbil_070
Consorzio di Bonifica Ionio Catanzarese,97059050795,"Via C. Gironda Veraldi, 12",88100,bonificacz@pec.it,97059050795,cbicat
Consorzio di Bonifica Ionio Crotonese,03008380796,"Via Sergio Ramelli,10",88900,consorzioioniocrotonese@pec.it,03008380796,cbikr
CONSORZIO DI BONIFICA LAZIO SUD OVEST,91168270592,"Corso GIACOMO MATTEOTTI, 101",04100,consorzio.bonifica.latina@pec.it,91168270592,SHJGFOSY
Consorzio di Bonifica Parmense,92025940344,Via Emilio Lepido 70/1A,43121,protocollo@pec.bonifica.pr.it,92025940344,cbp_
Consorzio di bonifica Piave,04355020266,"Via Via S. Maria in Colle, 2",31044,consorziopiave@pec.it,04355020266,1MF1PZD3
Consorzio di Bonifica Stornara e Tara,80005450731,"Viale Magna Grecia, 240",74121,bonificastornaratara@pec.it,80005450731,cbst
Consorzio di Bonifica Sud Pontino,00719640591,"Viale Piemonte, 140",04022,cbsp@pec.it,00719640591,cbsplt
Consorzio di Bonifica Terre D'Apulia,93238890722,"Corso Trieste, 11",70126,cbta.bari@pec.terreapulia.it,93238890722,cbtda_72
Consorzio di bonifica Terre dei Gonzaga in Destra Po,02122930205,via G. B. Spagnoli 5,46100,bonifica.gonzagadxpo@pec.regione.lombardia.it,02122930205,COBOTG_20220125
Consorzio di Bonifica Tirreno Catanzarese,92022660796,"Via Fratelli Ponzio , 5",88046,bonificalamezia.protocollo@pec.it,92022660796,cbtc_cz
Consorzio di Bonifica Trigno e Biferno,82000710705,Via Cairoli 31,86039,consorzio@pec.bonificatermoli.it,82000710705,cbtb_070
Consorzio di Bonifica Ugento e Li Foggi,81001130756,Strada Provinciale n. 72,73059,protocollo@cbuf.legalmail.it,81001130756,cnz_bulf
Consorzio di Gestione Amp Torre del Cerrano,90013490678,S.s. 16 Adriatica Km 431,64025,torredelcerrano@pec.it,90013490678,cgatc_
Consorzio di Gestione Area Marina Protetta Porto Cesareo,03706060757,Via Manzoni,73010,segreteria@pec.areamarinaprotettaportocesareo.it,03706060757,cgamp
Consorzio di Gestione dell'Area Marina Protetta del Promontorio di Portofino,91031820102,Via Alla Penisola Castello Brown,16034,ragioneria@pec.portofinoamp.it,91031820102,cgampo
Consorzio di Gestione dell'Area Marina Protetta Tavolara Punta Coda Cavallo,91028410909,Via Dante 1,07026,amptavolara@pec.it,91028410909,c_gamp
Consorzio di Gestione di Torre Guaceto,01918280742,Via Verdi 1,72012,segreteria@pec.riservaditorreguaceto.it,01918280742,cgtg
CONSORZIO DI POLIZIA LOCALE ALTO VICENTINO,92000030244,"Via Fratelli Pasini, 74",36015,plaltovi.amministrazione@pec.altovicentino.it,92000030244,cpl_asc
"Consorzio di Sviluppo Industriale Delle Valli del Tronto, dell'Aso e del Tesino",00387320443,Via della Cardatura snc,63100,info@pec.picenoconsind.com,00387320443,csidv_44
Consorzio elettrico di Pozza di Fassa,00104200225,"Strada de Pucia, 3",38036,pozza@legalmail.it,00104200225,CEP_20221003
Consorzio Elettrico Industriale di Stenico S.C,00124060229,Ponte Arche Via Marconi,38077,amministrazione@pec.ceis-stenico.it,00124060229,ceiss
Consorzio Erbese Servizi alla Persona,02984610135,Via 1 Maggio 58,22036,consorzioerbese@pec.it,02984610135,cesp
Consorzio Fitosanitario Provinciale di Modena,80009530363,"Via Venceslao Santi, 14",41123,fitosanmodena@postacert.regione.emilia-romagna.it,80009530363,cfpmo_mo
Consorzio Impegno Sociale,90015440135,Via Monte Grappa 95,22070,impegnosociale1@lamiapec.it,90015440135,cis
Consorzio Industriale di Interesse Regionale di Chilivani-Ozieri,81000150904,Zona Artigianale Chilivani,07014,zirozieri@pec.it,81000150904,ciir_20210510
Consorzio Informatica e Territorio S.P.A.,01321400192,"Via Del Commercio, 29",26013,consorzioit@pec.it,01321400192,citsrl
Consorzio Intercomunale Acquedotto Vina,00122530801,Via Statale 18 Km. 485,89015,acquedottovina@pec.it,00122530801,ciav
Consorzio Intercomunale Dei Servizi Sociali - Ciss Ossola,01606830030,"Via Mizzoccola, 28",28845,ciss@pec.ciss-ossola.it,01606830030,cidssos
Consorzio Intercomunale Dei Servizi Socio-assistenziali C.I.S.S. 38,07262240018,"Via Ivrea, 100",10082,ciss38@pec.it,07262240018,cidss
Consorzio Intercomunale Dei Servizi Socio Assistenziali Dei Comuni dell'Alessandrino,01740340060,"Via Galimberti, 2/a",15121,cissaca@pec.it,01740340060,cidssa
Consorzio Intercomunale dei Servizi Socio Assistenziali del Biellese Orientale,92007810028,"Via Mazzini, 2 M",13836,cissabo@pec.ptbiellese.it,92007810028,cissabo
Consorzio Intercomunale del Novese dei Servizi alla Persona,01742390063,Piazzale Dei Partigiani 1,15067,info@pec.cspnovi.it,01742390063,cinds
Consorzio Intercomunale di  Servizi,95551120017,"Strada Volvera, 63",10043,cidis@pec.cidis.org,95551120017,cis_orba
Consorzio Intercomunale di Rio Marsiglia,90009410102,"Piazza Cavagnari, 7",16044,riomarsiglia@pec.it,90009410102,cirm
Consorzio Intercomunale di Salvaguardia Ambientale,91005820922,"Corso Repubblica, 12",09038,cisaconsorzio@pec.it,91005820922,cisa
Consorzio Intercomunale per la Gestione dei Servizi Socio - Assistenziali dell'Ovest Ticino,01622460036,Via B. Gambaro N. 47,28068,protocollo.cisaovesticino@cert.ruparpiemonte.it,01622460036,cigssa
Consorzio Intercomunale per La Gestione Dei Servizi Socio Assistenziali,91006010036,Viale Liberta' 30,28021,protocollo@pec.cissborgomanero.it,91006010036,cilg_003
Consorzio Intercomunale Servizi Sociali CISS Pinerolo,07329610013,"Via Montebello, 39",10064,cisspinerolo@cert.dag.it,07329610013,cisspito
Consorzio Intercomunale Servizi Sociali di Chivasso,07224580014,Via Togliatti n. 9,10034,ciss@pec.ciss-chivasso.it,07224580014,ciss_chi
Consorzio Intercomunale Servizi Socio Assistenziali - Zona Cusio,01608900039,Via Mazzini 96,28887,ciss-cusio@pec.it,01608900039,cissa_1
Consorzio Intercomunale Servizi Socio Assistenziali C.I.S.A.S.,94050080038,"Via Caduti Per La Liberta', 136",28053,postacertificata@pec.cisasservizi.it,94050080038,cinta
Consorzio Intercomunale Servizi Socio Assistenziali Caluso,07264440012,"Via San Francesco, 2",10014,consorzio@pec.cissac.it,07264440012,cissac_c
Consorzio Intercomunale Servizi Socio Assistenziali di Pianezza,07239020014,Viale San Pancrazio 63,10044,protocollo.cissa@pec.it,07239020014,cissa_pi
Consorzio Intercomunale Servizi Socio Assistenziali IRIS di Biella,90035880021,Via della Repubblica 22B,13900,iris@pec.ptbiellese.it,90035880021,cissa_bi
Consorzio Intercomunale Socio Assistenziale 31 di Carmagnola,07584640010,"Via Avvocato Cavalli, 6",10022,protocollo@pec.cisa31.it,07584640010,cisa31
Consorzio Intercomunale Socio Assistenziale C.I.S.A - Asti Sud,01177050059,"Via Gozzellini, 56",14049,cisaastisud@legalmail.it,01177050059,cisa_ats
Consorzio Intercomunale Socio Assistenziale C.I.S.A - Tortona,01741580060,Via Milazzo n. 1,15057,cisa-tortona@pec.it,01741580060,cisac_al
Consorzio Intercomunale Socio Assistenziale C.I.S.A di Gassino Torinese,07306200010,"Via Regione Fiore, 2",10090,cisa.gassino@actaliscertymail.it,07306200010,cisa_to
Consorzio Intercomunale Socio Assistenziale di Rivoli - Rosta - Villarbasse,07289540010,"Via Nuova Collegiata, 5",10098,postacertificata@pec.cisarivoli.it,07289540010,cisarivo
Consorzio Intercomunale Socio assistenziale VALLE DI SUSA - VAL SANGONE,96020760011,"Piazza San Francesco, 4",10059,conisa.segreteria@pec.conisa.it,96020760011,cis_001
Consorzio Intercomunale Soggiorni Climatici,93005600239,"Via Macello, 23",37100,cisoc@pec.it,93005600239,ciscv
Consorzio Intercomunale Torinese,97503930014,Via Orvieto 1,10122,cit@pec.cit-torino.it,97503930014,cit
Consorzio Interuniversitario Nazionale Metodologie e Processi Innovativi di Sintesi,93101650724,"Piazza Umberto I, 1 Palazzo Ateneo Universita' Degli Studi",70100,consorziocinmpis@pec.it,93101650724,cinmpis
Consorzio Interuniversitario Nazionale per L'Informatica,03886031008,"Via Ariosto, 25",00198,Consorzio.CINI@legalmail.it,03886031008,cinl_058
Consorzio Isola di Ariano per I Servizi Sociali,90010080290,Via Roma 673,45015,protocollo.ciass@legalmail.it,90010080290,ciais
Consorzio Isole Dei Ciclopi,03865390870,Via Dante 28,95021,consorzio@pec.isoleciclopi.it,03865390870,cidc
Consorzio Isontino Servizi Integrati,80000750317,"Via Zorutti, 35",34072,cisi-gorizia@certgov.fvg.it,80000750317,COISSEIN
Consorzio Kairos scs,08134210015,Via Lulli 8/7,10148,consorziokairos@pec.it,08134210015,ck_030322
Consorzio Lamma,94152640481,"Via Madonna Del Piano, 10",50019,ammlamma@postacert.toscana.it,94152640481,clasv
Consorzio Le Valli,92003000236,Localita Crosaron di Villabella 18,37047,levalli@postecert.it,92003000236,clv
Consorzio Monviso Solidale,02539930046,"Corso Trento, 4",12045,ragioneria@pec.monviso.it,02539930046,cms_004
Consorzio Obbligatorio Strade Vicinali di Uso Pubblico Comune di Corchiano,90109170564,"P.zza Del Bersagliere, 1",01030,consorziostradecorchiano@pec.it,90109170564,cosvu
Consorzio Oltrepo' Mantovano,93012120205,Piazza Gramsci 5,46020,consorziooltrepomantovano@pec.it,93012120205,com_020
Consorzio Ovest Solidale,95546580010,Via Nuova Collegiata 5,10098,consorzio@pec.ovestsolidale.to.it,95546580010,cidsp
Consorzio Padova Sud,04720310285,"Via Rovigo, 69",35042,padovasud@pec.it,04720310285,cpspd
Consorzio Parco Brughiera Briantea,91013020150,"Via Aureggi, 25",20823,certificata@pec.parcobrughiera.it,91013020150,cpbb
Consorzio Parco del Lura,95064420136,"Largo Clerici, 1",22071,parco.lura@legalmail.it,95064420136,co_prdlu
Consorzio per I Servizi Socio Assistenziali del Monregalese,02536070044,Corso Statuto n.13,12084,cssm.mondovi.cn@legalmail.it,02536070044,cissa_
Consorzio per I Servizi Socio Assistenziali Delle Valli Grana e Maira,02565690043,Via Pasubio 7,12025,consorziogranaemaira@postecert.it,02565690043,ciss_004
Consorzio per I Servizi Territoriali del Noce - Stn Val di Sole,02345700229,Piazza Regina Elena 17,38027,male.stnvaldisole@pec.it,02345700229,cistn
Consorzio per Il Bacino Imbrifero Montano del Pellice,85006380019,Piazza Terzo Apini 1,10064,consorzio.bimpellice@cert.dag.it,85006380019,cibim
Consorzio per L'Area di Sviluppo Industriale di Lecce,00380090753,Zona Industriale,73100,consorzio.asilecce@legalmail.it,00380090753,casil
"CONSORZIO PER L'INNOVAZIONE E LO SVILUPPO LOCALE, LA PROMOZIONE DELLA CULTURA, DELLA RICERCA E DEGLI STUDI UNIVERSITARI - CIRPU",92020770647,Piazza XXIII Novembre Casa della Cultura V. Hugo,83100,consorziouniav@pec.it,92020770647,cilpc
Consorzio per L'Integrazione e L'Inclusione Sociale dell'Ambito di Maglie,92027370755,Piazza Aldo Moro N. 1,73024,ambitosociale.comunemaglie@pec.rupar.puglia.it,92027370755,clili
Consorzio per l’innovazione tecnolgica Scrl - DINTEC,04338251004,"Via Nerva, 1",00187,dintecscrl@legalmail.it,04338251004,Scrl_20201022
Consorzio per La Attivita Socio Assistenziale,01875940023,Viale Guglielmo Marconi N. 102,13045,segreteria@pec.consorziocasa.it,01875940023,clasa
CONSORZIO PER LA REALIZZAZIONE DEL SISTEMA INTEGRATO DI WELFARE ATS BR 4,02673320749,Via EUGENIO SANTACESARIA 7,72023,consorzio@pec.ambitomesagne.it,02673320749,TFWVPPE9
Consorzio per La Ricerca e L'Educazione Permanente Torino,05462680017,"Via Ventimiglia, 115",10126,corep.pec.amm@pec.it,05462680017,clrlet
Consorzio per La Scuola Mosaicisti del Friuli,81000930933,"Via Filippo Corridoni, 6",33097,scuolamosaicistifriuli@legalmail.it,81000930933,clsm_093
Consorzio per La Zona Industriale di Interesse Regionale di Sassari,80003630904,Zona Industriale Predda Niedda - Strada N. 34,07100,ZIRPREDDANIEDDA@PEC.IT,80003630904,clz_090
